女朋友背叛我怎么办	爸爸哥哥不要了写完了吗	0
手机丢失造成的资金损失会赔付的饿哦	手机丢失后产生的资金损失会给予赔付	1
日本最黄的动漫是什么？	最适合情侣看的电影是什么	0
悠悠球魔术手套图解	悠悠球东京铁塔图解	0
小练笔怎么做	小练笔，怎么写	1
苹果手机怎么用搜狗输入法	苹果手机搜狗输入法怎么字打不上	0
针织长开衫怎么搭配	针织开衫怎么搭配	1
李敏镐留的是什么发型	李敏镐的是什么发型，	1
使用过借呗会影响我的银行存款吗	芝麻信用和借呗会互相影响吗	0
[机构]转账提示证件过期怎么处理	资金转出 显示身份过期怎么办	1
如何让电表反转	如何使电表反转	1
怎么对付小人？	如何对付小人?	1
什么脸型配什么样的发型才好看	头发少的人做什么样的发型好看呢	0
花呗用超了***怎么办	花呗用超了一千多块钱怎么办	1
天天酷跑白金小帅配什么坐骑好	天天酷跑白金小帅配什么坐骑2015	1
天天酷跑什么挂最好	天天酷跑什么坐骑最好	0
红豆杉价格	弹弹堂私服	0
中国一共有几种书体	中国一共有几种方言	0
世界上最宝贵的东西是什么？	世界上什么东西最宝贵。	1
自己一个人怎么做仰卧起坐	如何做仰卧起坐？	1
若问是哪部电视剧的插曲？	《等你爱我》是哪部电视剧的插曲	0
求推荐耽美小说	求推荐一些耽美小说！	1
怎样把手机弄坏？帮帮忙	如何把手机弄坏？	1
求青春不败第一季全集	求军火女王插曲	0
给我说一些霸气的空间名称	谁有好听的手机来电铃声跟我说说	0
怎么在网上交网费	网上怎么交网费呢	1
有好的网络游戏吗？	有雀斑用什么好？	0
香奈儿手表怎样吗？	仿香奈儿手表怎么样	0
来自星星的你还有第二部吗？	有来自星星的你第二部吗？	1
有关于梅花的古诗有哪些	关于梅花的诗有哪些啊	1
怎么做个好人？	如何做个好人	1
联想华硕哪个好	联想，华硕哪个好	1
怎样创造自己的世界？	我的世界手机版怎么创造自己的ip	0
圆脸男生适合什么发型	圆脸男士适合什么发型~	1
蚂蚁借呗关闭了如何再开通	蚂蚁借呗关了，如何开通	1
付费产品购买流程	怎么买你们的付费产品	1
我的花呗是否收取费用	如何使用花呗扫码收费	0
在家带孩子想做兼职怎么办？	在家带孩子。想兼职。	1
什么食物补肾？	吃什么食物能补肾	1
正太是什么意思？	小正太是什么意思	1
女人吃榴莲有什么好处	吃榴莲对身体有什么好处和坏处	0
小米手机好还是苹果手机好？	小米的手机贵还是苹果的手机贵	0
怎么把花呗换到另一个手机号上去	花呗手机号码换了，怎么解除	0
河南籍的明星有哪些？	有哪些明星是河南的	1
班魂，班级口号，特色名称，艺术标识	幼儿园班级名称取什么名更好呢，更有特色？	0
吉他自学三月通怎么用啊？	吉他自学三月通怎么样	1
花呗逾期能否重新申请开通	花呗逾期过还可以从新申请使用吗	1
肺气肿什么原因造成？	肺气肿和肺大泡的区别是什么	0
这句日语是什么意思啊？	日语这句话什么意思	1
那些小游戏最好玩？	最好玩的软件有哪些	0
如何捕捉野鸡	怎样捕捉野鸡	1
御龙在天副将几级可以出战？	御龙在天几级可以单挑王城70级名将	0
女性小腹胀痛,还想放屁是什么原因_百度拇指医生	小腹胀痛，胀气，放屁多是什么原因引起的	1
王姓宝宝起名	王姓龙宝宝起名	0
微博话题怎么取消赞	微博怎么取消话题赞	1
近义词惋惜还有什么么	凉爽和冷是近义词吗？	0
忘记股票账号和密码怎么办	为什么自己看不到自己完整帐号	0
怎样投稿？哪些报社好？	哪些报社可以投稿呢？	1
马子是什么意思？	她是我马子是什么意思？	0
逆战名字空格怎么打？	逆战怎么打空格名字	1
与对方联系一下的，辛苦您了。	花呗的开通方式是系统匹配的，辛苦您在后续关注下的。	0
腋窝易出汗而且有异味，怎么回事啊	腋下出汗有异味，剃完的腋下毛，不怎么长	0
为什么我看不到论股呢	升级后总是看不到自选股	0
棋牌游戏大厅哪个好？	棋牌类游戏平台哪个好?	0
网上车辆违章如何查	网上怎么查车辆违章	1
买了收费产品用不了怎么办	在别的证券公司开户,可以用你们的软件吗	0
这是哪部电影的海报？	这是哪部电影里的海报？	1
[机构]能否绑定[机构]储蓄[机构]卡	交费了 为什么不能使用	0
全世界和全宇宙那个大啊	地球和月球那个大？	0
什么牌子粉饼好用又细	什么牌子的粉饼比较好~	1
有关长江形成的传说	关于斑竹的传说	0
国家规定今年过年什么时候放假？	过年国家法定节假日是什么什么时候	0
支付宝和微信支付哪个好	支付宝和财付通哪个好？	0
足浴哪个牌子好	足浴药哪个牌子好	1
人间四月芳菲尽的下一句是什么?	人间四月芳菲尽，下一句是什么	1
付费产品购买流程	我那个[机构]那个软件,它现在使不了	0
公园里有什么	一什么公园	0
什么是垃圾食品？包括哪些？	什么是垃圾食品，为什么要人们远离垃圾食品？	0
请问过敏性哮喘有哪些症状呢	患上过敏性哮喘有什么特征	1
我的儿子叫什么？\	海的儿子叫什么	0
原来可以借呗额度设置的	借呗可以调低	0
郭德纲相声问题、、	有关郭德纲相声问题…	1
感性和理性有什么区别	感性和理性究竟有什么区别	1
怎么样中的双色球大奖	怎样中双色球大奖	1
委托登录不上提示账号或通讯密码不对怎么办	资产分析中总资产数据不正确	0
协调有序是什么意思	协调有序的意思是什么？	1
人生的意义是什么啊	人生的意义是什么？	1
用一张身份证买两张火车票可以吗	可以用一张身份证买两张火车票吗	1
谁会自己制作文字图片	怎样自己制作文字图片？	1
周末兼职工作有哪些	周末兼职可以做哪些工作	1
怎么化眼线？	眼线膏怎么用	0
手机屏幕出现彩色一块	手机屏幕有一块点不动	0
用花呗支付，扣银行卡的钱	花呗线下支付扣了余额里的钱	1
我想做个花呗分期	花呗可以连续三个月分期吗	0
港澳通行证可以异地办理吗	临时身份证可以办港澳通行证吗	0
爸爸去哪儿有那么好看吗？	《小爸爸》好看吗？	1
高中数学题，求助！	紧急求助，高财题。财务	0
早晨上不来气是肺气肿吗	早上起床后呼吸不顺畅是肺气肿吗	1
有什么好吃的蔬菜	什么蔬菜最好吃	1
怎么修改百度知道的用户名？	怎样修改百度知道用户名	1
哪吒的妈叫什么	哪吒姓什么？	0
5月3号中午12点京沪高速堵车吗	京沪高速堵车吗2015,3月1日	0
摩尔庄园的龙蛋怎么获得？	摩尔庄园的龙蛋怎么获得	1
登录提示软件版本过低怎么办	老是连网用不了	0
怎么样可以看出一个人喜欢你	怎么看出一个人喜不喜欢你啊	1
什么打字软件最好用？	你们都用的什么电话铃声	0
国产什么牌子化妆品好	国产化妆品什么牌子好	1
有什么好玩的开罗游戏	愤怒的小鸟那个版本的好玩。	0
花呗付账不能用集分宝吗	集分宝还花呗	0
天王盖地虎。后面是什么	天王盖地虎是什么暗语	1
京东商城偏远地区送货上门吗	京东商城送货快吗	0
骑马与砍杀修改器	骑马与砍杀的修改器	1
如何瘦小腿肚、	小腿肚粗怎么减	1
卡西欧手表怎么样	卡西欧手表怎样	1
新浪微博怎么换头像	新浪微博怎么改头像	1
怎么设置花呗花呗支付密码	借呗设密码	0
肺结核潜伏期会不会传染	肺结核严重的需要手术吗	0
CT能区分肺结核和肺癌的区别吗	肺癌的症状有哪些	0
如何办理变更[机构]卡业务	为什么更换[机构]卡后,赎回还是显示旧卡	0
声卡驱动问题	声卡驱动问题‘	1
手机和电脑自选股不同步怎么处理	电脑上的自选股想和手机上的自选股同步	0
我不知道怎么还花呗的钱	怎么还是要我还花呗	1
怎么下载直播吧上的视频啊	直播吧的视频怎么才能下载？	1
帮小说起名字	帮小说女主起个名字	0
我今天用的花呗，是这月***号还还是下个月	***月***号花的，也是***号之前还吗用花呗	0
这是什么叶子	这是什么树的叶子	1
麻烦您提供下银行卡的后4位，这边核实下	麻烦您提供一下银行卡尾号后4位这边帮您核实的	1
有什么好的创业项目！	有什么好的创业项目？	1
北京哪里有卖刀剑等工艺品的?	漆器工艺品北京哪里有卖的？	0
关于学习的成语	与学习有关的成语有	1
京东和天猫哪个好	京东和天猫那个好！	1
休闲袜和运动袜有什么区别	休闲服和运动服有什么区别?	0
素炒蘑菇怎么炒好吃	蘑菇怎么做好吃	0
两个胖子(打一城市名)	两个胖子，打一城市。	1
不喜光盆栽植物有哪些	盆栽植物需要哪些化肥	0
安徽机电职业技术学院计算机专业行不行	安徽机电职业技术学院一年学费	0
如何下载同花顺软件	不能交易,要下载app怎么回事	1
用自己的照片是发型	给自己照片换发型	1
第三题怎么写	第三题怎么做？	1
什么牌子的围巾好啊?	围巾什么牌子好	1
上海哪里有卖素描包	上海那里可以学素描	0
例如我今天多么的快乐照样子写一句话	有没有好点的一句话,是希望别人开心快乐的	0
第三个是什么	第三个叫什么	1
你的爱情故事	人与鬼的爱情故事	0
借呗多久评估一次，依据是什么	借呗还完后多久评估额度	0
我的花呗，开通了	开通花呗支付宝账号忘记账号了	0
妆的笔画笔顺	火的笔顺笔画	0
问道装备价钱	巨龙模拟器怎么弄装备	0
发福利，先到先得	发福利啦，先到先得	1
您好，请问您是是有哪家银行操作的呢？	您好，请问您是操作的转账到哪家银行卡？	0
已回答过的问题如何删除？	如何修改或删除回答的问题	1
怎么让女友回心转意。	该怎么做才能让女友回心转意	1
我是歌手第三季，什么时候开始播啊	我是歌手第三季第一期什么时候播	1
求楪祈的这张原图	谁有这张原图	0
小二核实到已经是成功的哦	这边核实了是已经成功的哦	1
兔子什么不能吃？	兔子不能吃什么	1
什么耳机好	什么耳机好？	1
周公解梦梦见从银行卡取了许多钱	周公解梦梦见银行卡断了	0
汇通快递怎么样呢	国通快递快吗	0
淘宝店怎么装修	开淘宝店怎么装修呢	1
请问这种植物叫什么名字	请问这种植物叫什么名字、	1
天空之城双手简谱	天空之城的简谱双手	1
蚂蚁借呗还款，在哪里	使用蚂蚁借呗之后怎么还款	0
赛尔号希路达在哪怎么抓	赛尔号希路达怎么捉	1
云南警官学院还属于公安部的学院吗？	云南警官学院什么专业好？	0
补水面膜什么样的好啊？	什么样的补水面膜好用	1
我的世界猫走不了	为什么我的世界玩不了	0
端午节高速上收费吗？	端午节高速有收费吗？	1
恋恋不舍什么意思	恋恋不舍的舍的意思是什么	0
初二数学题	电视机无图像无声音	0
人和畜生的区别是什么？	人和畜生的区别是什么	1
这个心电图正常吗？	我的心电图值正常吗？	1
如何参与和搞好学生会工作	如何做好学生会主席的工作	0
小孩支气管炎咳嗽老不好怎么办	咳嗽可以吃什么药	0
什么牌子的猪肉脯好吃	什么牌子的猪肉铺好吃	1
辽宁省朝阳市都有什么县呀	辽宁省每个市都有哪些县	0
斗罗大陆的漫画哪里有的下载？	在哪里下载斗罗大陆漫画。	1
这个叫什么玩偶？	这玩偶叫什么？	1
急求4人英文短剧剧本	7人英语短剧剧本	0
我是歌手张宇唱的什么	我是歌手张宇退了吗	0
我的花呗分期了一次还能分期不	花呗可以一次分期两次吗	0
什么季节？	什么季节	1
花呗分期后一次还清还可以在用花呗分期吗	花呗账单分期一年可以申请几次	0
废物利用牛仔裤	找勾毛线鞋子的图案	0
电玩城海洋之星2海啸来袭捕鱼游戏单机版下载	星之海洋游戏下载	0
您的账户是否有实名认证呢	您的账户是否实名认证呢	0
大家都是女人何苦为难女人呢	女人何苦为难女人	1
注册同花顺账号提示已注册怎么办	哦我现在在注册那个账户账户吧,是这样子它发的验证码我是按照它的输入的怎么老是显示错误	0
这是什么东西？果果	这是什么东西，在哪说	0
同花顺钱包转入资金失败怎么办	我从[机构]账户转了十万多到同花顺钱包,伱们显示转入失败,可[机构]显示已转出成功,目前我两个账户上都没钱	1
您的扣款金额是多少呢	辛苦您填写下您的账户可用余额(单位	0
酱肘子怎么做好吃	猪肘子怎么做才最好吃	1
怎么用姓名查身份证号码	只有姓名怎么查身份证号码？	1
我想咨询同花顺付费产品	哦,我要查一下你们那个订这个里面那个呃账户里面购的,那个不在回购的话哦,没有记录,我成交了没有记录是怎么回事我想问一下	0
怎么开洗车店？	怎么洗车	1
万有引力变奏曲漫画	类似万有引力变奏曲	0
这个烫发发型叫	这个发型怎么嫩的，用烫发吗	0
我想关闭这个帐户的花呗，在另一个帐户开通花呗	然后我现在这个支付宝也有一个花呗 我现在这个花呗还不来花呗	0
北斗七星与蛇打一成语	北斗七星高，七的成语	0
有什么好玩的网页游戏不用下载客户端的	4399有什么好玩的枪战网页游戏,不用下载的	0
粗犷的近义词是什么。	粗犷的近义词是什么？	1
自己一个人玩，有什么好游戏？	我喜欢一个人，怎样让他喜欢我？	0
全民枪战的兑换码是什么	全民枪战兑换码是什么？	1
走过路过不要错过！	走过路过不要错过。	1
男属兔女属羊可以相配吗？	男属虎和女属牛的相配吗？	0
同花顺钱包转出到[机构]卡的限额是多少	请问你们[机构]有没有[机构]卡的限制	0
简单好看的马尾怎么扎？	怎么扎马尾好看又简单	1
如何做微店代理？	微店怎么代理	1
三国网游小说	关于网游三国的小说	1
病毒性肺炎和细菌性肺炎如何区分	病毒性肺炎和细菌性肺炎哪个更好治疗？	0
孕妇可不可以吃莲藕	香菇莲藕炖鸡汤孕妇吃了好不好	0
重置密码时忘了绑定的[机构]卡号怎么办	手机号更换了,手机收不到验证码,密码也忘记了,登陆不了账户	0
我换花呗的钱收不到验证码	花呗支付时验证码收不到怎么办	0
死得其所的所是什么意思	，死得其所什么意思	1
蚂蚁借呗最好额度	蚂蚁借呗最高多少万	1
资讯页面打不开或显示空白	我现在新闻资讯只能看到标题,看不到具体内容了	1
收款码为什么不能花呗收款	为什么我收钱码花呗客户现在用不了	1
此地无银三百两是什么意思，	此地无银三百两什么意思	1
你造吗？什么意思	我宣你，你造吗？都是什么意思？	1
哈尔滨凯德广场学府路负一楼有蛋糕吗？	学府路的凯德广场有香奈儿香水吗	0
恶魔高校第三季哪里可以看	在哪里看恶魔高校第三季?	1
韩语的晚安怎么说？	晚安，用韩语怎么说？	1
过年送什么给长辈	过年你们送什么给长辈	1
求在家可以做的兼职	在家可以做什么兼职的	1
怎样去除衣服上的霉味？	这种鞋子淘宝上怎么搜	0
穗可以组什么词语	添反义词组成语什么腔什么调	0
什么和什么都是特殊平行四边形	特殊平行四边形都有什么	1
基金赎回到同花顺钱包什么时候到账	需要过多久才能收到同花顺钱包转出的钱	0
很抱歉的呢，这个是需要给您发送邮件，您根据邮件提示操作的呢	这个不是的，需要您上传报错页面截图，然后工作人员给您查询原因的	0
唐朝历史上最著名的皇帝是谁	为什么唐太宗是历史上最著名的皇帝之一？	0
移动的流量怎么关闭	移动流量怎么关闭	1
如何修改个人信息	请问怎么修改个人资料	1
有没医学视频免费下载的地？	医学移动课堂里头下载的视频只能在里面看吗?	0
网上女装批发到底哪里好啊	网上服装批发哪里好（女装）	1
基金定投为什么会提前扣款	钱包可以用来定投扣款吗	0
肠胃炎忌什么？可以吃什么？	肠胃炎该吃什么药？	0
收款码不支持花呗付款	能用花呗支付，不能用信用卡支付	0
水果之王是什么水果？	什么水果是水果之王？	1
我是歌手主持人到底是不是张宇啊？	张宇为什么不主持我是歌手了	0
同花顺账号登录不上去怎么办	我的现在换了手机登陆不上	0
蓝色搭配什么颜色好看？	紫蓝色搭配什么颜色最好看	1
男士用什么牌子洗面奶好？	男士用洗面奶什么牌子好?	1
人人贷安全吗？	人人网安全吗	0
手机vip怎么使用	昨天开的户,今天[机构]转证券表示作废了	0
怎么赎回基金未付收益	赎回未确认还要等多少天	0
株洲哪里最好玩	株洲哪里好玩啊？	1
[机构]能绑定多少张[机构]卡	那个我要绑我要开个基金账户里面有绑定一个[机构]卡[机构]卡的那个那个那个电话不对	0
已退款，退回花呗，到找不到	淘宝退款退到花呗，我咋找不到	1
苹果手机怎么设置按键音	怎么消除手机按键声音	0
今天竟下雨了	今天下雨了	1
同花顺人工客服工作时间	人工服务什么时候上班	1
如何查询登录账号	用[机构]自己的软件可以登录,用同花顺提示主战网络繁忙	0
拿什么拯救你我的爱人	我拿什么拯救我的爱人？	1
这些英文分别是什么意思	这些英文是什么意思	1
建议您使用您自己的身份信息重新注册支付宝账户使用一下的，	建议您使用您自己的身份信息重新注册支付宝账户使用的	1
您好，请问是什么时间收到的短信？	您好，请问是提示是：没有欠费记录，输入信息有误，这个吗？	0
求修改图片中的数字，	求图片中的数字字体	0
淘宝网怎么投诉卖家	在淘宝网怎么投诉卖家	1
现在年轻人都喜欢做什么	现在的年轻人最喜欢做什么	1
利巴韦林颗粒要怎么给小孩吃	利巴韦林颗粒是一种常见抗病毒的药物吗	0
登录提示软件版本过低怎么办	我的账户被锁了,最新版本交易账户位置改变,和券商名称放在一起了	0
有谁是在家做手工活的	有什么手工活可以在家做	1
这是什么车呀，谁知道？	谁知道这是什么鱼？	0
如何扩大手机运行内存？	手机运行内存怎样扩大	1
你一夜能做几次爱	一夜能做几次爱？	1
小学数学游戏社团名称	小学趣味数学游戏	0
请问图片中的字是什么字体的？	请问下图片中的是什么字体？	1
现在女生流行什么颜色的头发?	现在女生头发流行什么颜色？	1
合肥最好吃的蛋糕是哪家	合肥哪家蛋糕好吃	1
换手机后增值服务不能使用怎么办	嗯手机旧手机话更换新手机号码	0
柠檬水可以减肥吗	减肥喝柠檬水好吗	1
小二这边也是想帮您核实的，但是这边确实也是没有操作的路径的，很抱歉	抱歉，这个是有专门的审核人员的，不是这边审核的，这边帮您加急审核	0
买完了,但是在持仓里看不见	我今天买入股票,委托了,但是为什么我的持仓里没有这只股票	1
说梦话怎么治	怎么能不说梦话	1
告白的时候说自己色是什么意思	告白什么意思？	0
屈臣氏有假货吗	屈臣氏假货好吗	1
电脑上账号登录不上去怎么办	我买了手机电脑版的lv-2,电脑版的用不了怎么办	0
忘记股票账号和密码怎么办	怎么找到自己的资金帐号	1
肺结核大概需要多长时间能查出来	肺结核确诊需要检查哪些	0
房地产开发公司起名	房地产经纪公司取名	0
我这软件怎么不能升级	如何升级到云端版本	0
中老年服装新款	中老年服装店装修	0
这样的上网本能玩什么游戏？	这款上网本能玩那个版本的劲舞团？	0
徐州属于哪个省的	徐州属于哪个省或者市？	1
图片变拼图软件	照片拼图软件	1
看看对不对	像这样的可爱卡通图片要男的谢了	0
世界上最有名的歌	世界上最嗨的歌	0
如何刷手机流量	手机流量怎么算	0
格力空调遥控器哪里有的买	保定哪里能买到格力空调遥控器	1
有斩赤红之瞳第二季吗？	斩赤红之瞳零更新完了吗	0
这是哪个节目啊	这是哪个节目？是戚薇和谁	1
恩，上面的号码和现在支付宝的号码一致吗？	这个的支付宝是6位的密码的这个的真的的。	0
电脑的声音问题	电脑声音问题	1
洁白的雪花像一什么什么	洁白的雪花在什么下	0
早更男友什么意思	男友什么意思？	0
夜宵吃什么好？	夜宵吃什么会瘦	0
有什么比较好的肉番	有什么比较好的减肥产品	0
求范冰冰苹果完整版	求范冰冰完整版苹果	1
《稻草人》作者是谁	稻草人的作者是谁	1
科沃斯扫地机器人质量怎么样？	科沃斯扫地机器人的质量怎么样？	1
我没有花呗借呗的钱怎么还款	蚂蚁借呗是怎样还款的	0
什么单机游戏好玩	什么单机游戏好玩一些	1
诗句上的植物的名	歌曲的名字、、、	0
如何解绑[机构]卡	解除手机账号绑定	0
怎么自截动漫高清头像	怎么高清自截动漫头像	1
暖脚贴有什么害处	鲎能吃吗，有什么害处吗	0
求恋爱养成类的游戏	求恋爱养成类游戏	1
模拟账号和密码忘记了怎么办	模拟账户号忘记了怎么办	1
买基金时提示查开户方原因怎么办	[机构]60天理财债券a.帮我分析是个什么意思.[numbers]元60天后我除去本金.有多少回报	0
怎样能快速怀孕？	怎么才能快速怀孕？	1
软件有问题了	哦,请问,你们,刚才我我的账户,我把这个账户打开你们那个长期你们的同花顺一个什么账户免费咨询服务这个协议吧,有是不是有这个协议啊	0
红米玩机手册从哪下载	分手大师手机从哪看	0
迎春花是什么颜色的	高锰酸钾是什么颜色的	0
有没有这个图片的情侣头像	这个图片的情侣头像有没有	1
我的麦克风没有声音怎么办？	为什么我的麦克风没有声音？	1
系统提示交易密码错误怎么办	资金无法转出到[机构],密码错误	0
多吃什么水果可以减肥	多吃什么水果减肥呢？	1
翻译翻译翻译。	翻译翻译翻译	1
买了收费产品用不了怎么办	我今天中午买了518元产品服务为什么下午看不了	0
社会心理学基础知识和有关书籍？	有没有有关心理学知识的网站	0
四面山光照，下一句是什么？	四面山光照下一句是什么	1
哪里可以看封神英雄榜全集啊	封神英雄榜哪里可以看全集	1
现在做什么小本生意好呢	现在小本生意做什么好	1
月字开头的成语有哪些?	以“天”字开头的成语有哪些	0
减肥晚餐只吃粥，可以吗？	晚餐少吃能减肥吗？	0
看手机视频用什么播放器好	手机用什么视频播放器好	1
徘徊的徊是什么意思？	各抒己见的意思是什么？	0
『大润发』领导请注意	【大润发】各位领导请注意拉	1
天龙八部畅易阁买号怎么样	倩女幽魂买号	0
中兴手机怎么样	怎么拆中兴手机	0
乌龟生气是什么样子的？	乌龟是什么样子的？	0
求曹查理演的一部电影	找一部曹查理演的电影名	1
手机如何申请微信账号	如何用一个手机号申请多个微信账号	0
冬天为什么广东不下雪呀	天气冷了大家要多注意保暖哦	0
病毒性肺炎可不可以吃洋葱	病毒性肺炎可以吃洋葱吗	1
如何修改密码	交易密码怎么修改	0
违规停车交罚款去哪里	违章停车罚款在哪里交	1
填空又什么又什么的太阳	太阳晒得什么？填空	0
上面是操作的流程的。	您是按上面的流程操作的吗	0
一见钟情的意思是什么	一见钟情啊！什么意思	1
天津什么最有名	天津有名的津菜是什么	0
铁齿铜牙纪晓岚有第五部吗	有上帝吗	0
运动鞋什么牌子的好，？	运动鞋什么牌子？	1
肺炎和支原体肺炎有什么区别	肺炎与支原体肺炎之间的区别是什么	1
为什么禁播生活大爆炸	生活大爆炸为什么被禁播	1
今天电影院放什么电影	今天电影院有什么电影	1
最恶心的电影叫什么	有什么恶心的电影	0
去你大爷的是什么意思？	我艹他大爷是什么意思？	0
白雪公主怎么画	和平鸽怎么画	0
为什么我看不到论股呢	今天委托价到了,显示买入,可是当日成交里显示没有,持仓里也看不到股票,钱也冻了用不了再买也不能用	0
她叫什么名字详细资料	这个女的是叫什么名字？详细资料	1
为什么购买不了创业板股票	前后几天买的股票为什么不能全部卖出	0
美女图片在哪里下载	美女图片从哪里下载	1
苹果手机耳机模式怎么调	苹果手机怎么用才省电	0
这个笑话是什么意思	笑话是什么意思	1
花呗的消费额度于什么有关	我的花呗怎么能用额度还是***	0
吃口香糖能减肥吗？	吃口香糖可以减肥吗	1
心情不好就哮喘是哮喘病吗	每次心情不好就哮喘这是哮喘病吗	1
