怎么注销账号	请问怎样将钱转出	0
腾讯出的洛克王国是抄袭彩虹城的吗？	请问腾讯的洛克王国抄袭的彩虹城的游戏吗？	1
栖息的近义词是什么呢	栖息的近义词是什么	1
深圳沙井客运站附近这一带有没有双休日做兼职的	深圳沙井镇上南附近有没有晚上兼职的工作	0
均匀的反义词	依照的反义词	0
为什么 蚂蚁借呗用不了了	蚂蚁借呗打不开了	0
您家人是否有这样的手机号码？	请问是您的这个手机号码收到的信息吗？	0
女友什么意思	女友说我是逗比。什么意思	0
如何使用手机level2软件	购买了280元的云端版怎么还是没有开通的	0
酷跑外挂怎么下载	酷跑外挂怎么使用	0
打印机问题	同济大学考研问题	0
怎么邀请别人用借呗	如何邀请别人用借呗	1
关于狼的文章	《弈喻》是初几的文章	0
用手机上百度各种问题	百度手机地图软件各种问题	0
什么风细雨	细雨(什么)	0
计算机的未来会怎么样	未来计算机行业的发展会怎么样	0
怎么做薯片	安利怎么做	0
图片上的花叫什么、那些紫色的花	全部紫色的是什么花图片	1
感冒时可以吃鸡蛋吗？	感冒了能吃鸡蛋吗？	1
梦幻西游好玩嘛？	梦幻西游好玩么	1
有什么好玩的手机安卓游戏	安卓手机有什么好玩的游戏。？	1
在家带小孩怎么赚钱？	我如何靠写歌词来赚钱	0
基金撤单如何操作	我在我炒股软件当中怎么能找到我的账户	0
脸上长痘痘的位置，大家用什么？	脸上长痘痘位置，你们用什么？	1
孙楠上天天向上唱的啥粤语歌	孙楠在天天向上唱的什么粤语歌	1
阿根廷和德国谁会赢？	德国和阿根廷谁会赢？	1
这叫什么酒？好喝吗	泡什么酒好喝	0
《中国好声音》冠军是谁？	中国好声音的冠军是谁？	1
为什么《流星花园》有被禁播？	爱情是什么？为什么会有爱情？	0
麻辣女兵是本小说吗	求麻辣女兵的小说	1
余额宝转出的时间您在操作后是无法为您加急的，请您耐心等待。	在此期间无法人为操作退回的，请您耐心等待一下。	0
为什么[机构]转证券转不了	股票帐号销户	0
求万有引力变奏曲漫画	求万有引力变奏曲的漫画	1
股票交易手续费是如何收取的	我买了[numbers]块的,为什么现在只有[numbers],期间没有操作	0
花呗开通怎么弄	我花呗开通怎么叫我认证	0
券商理财到期后收益在哪里看	钱扣了,交易失败,钱去哪里了	0
提示登录超时或者连接主站失败	交易登陆总是提示登陆超时或系统服务器忙,为什么	1
求一部香港的恐怖片	求香港的一部恐怖片	1
跑步机什么牌子好;	跑步机什么牌子好?	1
求图片：凌尔芬做我女朋友吧	求图片：尹武华的女朋友	0
你看到的我是蓝色的。	因为你看到的就是蓝色	0
蛋炒饭怎么做才好吃，	最好吃的蛋炒饭怎么做	1
网上哪里有摩托车买？	网上哪里可以买摩托车	1
基督教和犹太教有什么区别？	犹太教和基督教有什么区别吗？	1
你是我的眼原唱是谁	你是我的眼原唱谁	1
这是什么字体啊求大神	这是什么字体，大神们？	1
教师节送什么给老师？	教师节送老师什么花	1
铁西滔博运动城几点下班	滔博运动城体院店怎么样	0
抱歉，这边没有收到，辛苦您重新填写一下	抱歉，您填写的信息我们这边没有检测到，请您重新填写下的，辛苦您了。	1
电动车电机什么样的好	电动车电机号	1
手机上怎么在图片上写字？	怎样可以在图片上写字手机	1
石家庄都有什么特产？	常州有什么名吃，什么特产？	0
过年回家，买什么给父母好？	过年回家送父母什么	1
为什么她不喜欢吃我的鼻屎？	为什么有些人喜欢吃鼻屎	0
仇人相见分外眼红是什么生肖	仇人相见，分外眼红，是什么生肖	1
基金快速取现为什么还没到账	实时到帐最高金额是多少	0
【地狱边境】这关怎么过	地狱边境第20关怎么过	1
level2如何购买	你好!我想要购买同花顺280元的软件	0
重庆大学91级钢铁冶金专业毕业生秦军	北京科技大学钢铁冶金专业怎么样	0
十字架牌子叫什么	十字架是什么牌子的包	0
腾讯新闻评论怎么删除	怎么删除好友的评论？	0
软件是否支持新三板交易	[机构]证卷开户同花顺软件可以交易吗	0
学霸是什么意思？	学霸是什么意思啊	1
星星之火可以燎原	星星之火，可以燎原	1
额头窄颧骨高适合什么发型	颧骨宽，额头窄，适合什么发型呀	1
唯品电子烟的烟油安全吗？	电子烟到底安全吗？	0
26课威尼斯的小艇小练笔	威尼斯小艇的小练笔	1
味的甲骨文怎么写	及的甲骨文怎么写	0
艾玛什么意思。	艾玛是什么意思呢？	1
谁帮我设计下签名，	谁帮我设计个签名	1
短线宝如何购买	短线宝如何开通	1
无法修改绑定的手机号码	这个要换这个绑定的手机注册的账户的更换绑定的手机不能更换怎么办	1
我适合空气刘海吗？我是什么脸型	我的脸型适合空气刘海吗？	1
为什么我家问道进不去了	我家的问道今天怎么进不去	0
手机已经注册过了怎么重新注册	我那个手机号以前都是注册了我想重新这个注册手机号	1
为什么淘宝网登陆不了	淘宝网怎么登录不了	1
一什么笑脸	什么的笑脸	1
我是聋哑人找工作在哪里？	聋哑人适合找什么工作,哪里需要	0
凡客体是什么？	我的凡客体是什么	0
这是什么酒，多少钱一瓶	这是一瓶什么酒，	1
徐州哪里有买驴的	徐州是哪里的	0
今年冬季流行什么外套呢	今年冬季最流行什么外套？	1
定期理财持有到期实际收益有多少	固收理财产品持有到期后实际收益有多少	0
合肥有什么蛋糕房啊	合肥最好的蛋糕店？	0
有哪些搞笑的穿越小说	有哪些搞笑的穿越小说推荐下的啊	1
怎么登录	请问我的我的手机号码,哦,更改了,怎么登录啊	0
花呗的安全码验证不成功让换手机	花呗不还能换手机号不能	0
梦见自己掉粪坑里	梦见从粪坑里挖死人	0
与訫碎ヾ欲焚配对的情侣网名	情侣网名配对器	0
吃什么能让狗长胖点？	吃什么菜可以长胖些	0
发短信怎样隐藏自己的手机号码?	发短信怎样隐藏手机号码	1
为什么我的头发是自来卷？	空气刘海是烫的吗多少钱	0
我是歌手第二季有几期？	我是歌手第二季拉是第几期来的	0
眼睛散光怎么矫正过来?	散光怎么矫正	1
基金申购能不能撤单	我的基金非交易日可以赎回吗	0
电饭锅什么牌子比较好	什么牌子的电饭锅比较好啊	1
我是男人怎么还喜欢男人？	我就是好男人好男人就是我	0
动漫孕妇	哪个动漫东西来着	0
军事理论论文怎么写优秀	军事理论论文怎么写啊	1
爱上你是我的错	我为什么会爱上你	0
妈妈50岁生日送什么礼物好	妈妈生日送什么礼物好呢	1
我余额宝有钱借呗不是自己扣的吗	蚂蚁借呗余额宝可以自动还款吗	1
那您登录您的手机号账户查看一下哦亲	是的，辛苦您是登录这个手机账户查看下的。	1
赛尔号之巴弗洛什么性格最好？	赛尔号巴洛卡和波克尔哪个厉害？	0
你有什么愿望啊	你的愿望是什么	1
武汉工程大学好还是湖南科技大学？	湖南科技大学和安徽工业大学哪个好？	0
花呗***逾期一天利息多少	花呗逾期的利息怎么算	1
(我去年买了个表)是什么意思	我去年买了个表，什么意思？	1
这两个哪个睡衣好看？	这两个睡衣哪个好看	1
淘宝上退货怎么退	淘宝上如何退货	1
新股申购流程	我要申购新股票	1
基金赎回后资金会到哪里	基金卖出要等十几天到帐	0
第三十八年夏至古筝谱！急求	第三十八年夏至古筝谱	1
陈赫离婚了吗，是真的吗	陈赫离婚了？真的吗？	1
聚美优品化妆品团购怎么样	聚美优品化妆品怎么样	0
鬼月怪物猎人漫画	怪物猎人漫画鬼月	1
怎样使鼻梁变高？	怎样让鼻梁变高？	1
三星手机怎么看型号？	我的三星手机怎么查型号？	1
世界上最小的国家叫什么名？	世界上第一个人叫什么名字？	0
网上买彩票安全么?	网上买彩票安全吗?	1
可以的。请问您的身份证后八位可以提供一下吗？	请问您是提供的完整的证件号码的还是提供的后8位的身份证号码的？	0
这个账户就是您的已认证账户，并没有其他关联认证账户	或者登录已经认证的账户关联没有认证的账户。（认证的页面点击+账户）	0
验证码错误怎么办	喂喂喂我登录软件提示我版本过低啊	0
什么牌子空压机好？	什么牌子的空压机好	1
您好，请问是从哪里查的看到您天猫宝为0元？	您好.请问您是在哪里核实到您的天猫账单的.	0
羊肠小道后劲十足是什么生肖	羊肠小道，后劲十足是什么生肖	1
他不爱我，的原唱是谁？	你是我的眼的原唱是谁？	0
如何查看股票的筹码分布	哎今天谁打我电话你们什么	0
浙江哪里最好玩	浙江哪里好玩啊？	1
请帮忙指导写关于英语语言学方面的硕士论文?	跪求关于英语语言学的论文！	0
证券转[机构]转不了怎么办	可转金额总是显示零,但是我账户里明明有钱呢为什么转不出来到卡上	0
时空猎人破解版添加源	安卓时空猎人破解版	0
剑灵怎么得财源广进	剑灵财源广进怎么得	1
奇迹如何造句	奇迹怎么造句	1
我拿花呗付的是货到了才确认收货还是现在确认收货	花呗付款是确认收货之后开始算吗	0
冬天来了，煲什么汤最好！	冬天煲些什么汤喝比较好	1
如何办理建筑加固资质	新疆如何办理建筑企业资质	0
你觉得我发的这个动漫头像好看吗？	谁有好看的头像啊？非人非动漫的，有吗？	0
最近江苏会发生破坏性地震吗？	江苏会发生大地震吗？	1
付费软件什么时候到期	神奇电波是什么	0
有动物名称的成语	关于动物名称的成语	1
我从来没用过花呗买过东西	花呗上没有买东西为何每月都有扣款	0
如何让自己内心变得更强大	如何能够让自己内心变得更强大…	1
小说重生在三国	关于三国的重生小说	1
如何减掉大肚腩	怎么样才能减掉大肚腩？	1
电影夜店的插曲是什么歌？	电影夜店朱辽唱的插曲叫什么	1
女人夏天带胸罩，热吗？会不会出痱子？	女生可以赤膊吗，夏天很热，不想带胸罩	0
我要退款怎么办	行情速度太慢了啊	0
河北哪里收购嫩玉米	河北哪里收购玉米秸秆	0
天天酷跑什么精灵好哦	天天酷跑精灵用什么买	0
广东哪里工资高？	广东那里的工资高？	1
花呗绑定另外支付宝账号	花呗能绑定到另一个手机号么	0
内气功是不是真的存在？	和尚用气功治病，是不是真的	0
货币基金如何购买	怎样购买货币基金	1
花呗分期 ***期	花呗分期，好吗	0
求学生会长的忠告的漫画	求学生会长的忠告漫画全部	1
用同花顺交易收不收费	我每交易一次多少钱手续费	0
办理中国银行信用卡怎么样？	怎么样办理信用卡？	0
黑子的篮球第三季什么时候出	黑子的篮球第三季什么时候出？	1
摩尔庄园去黑森林	摩尔庄园黑森林	1
怎样下载奥拉星小黄人	奥拉星小黄人怎么下载	1
因为您的账户是没有实名认证的，是需要您上传资金凭证的	您好，小二这边帮您核实到您之前申请认证的失败的原因是：证件整体模糊	0
怎样才知道自己是不是处	怎么知道自己还是不是处	1
如何使用涨停助手	涨停基因付款后怎么用	1
赛尔号的布鲁克克怎么捉？	赛尔号怎么打布鲁克克	0
送你一匹马什么意思	一匹黑骡什么意思	0
侠盗猎车手圣安进地列斯贝壳11	圣安斯地列斯直接输入作弊码没用	0
新婚之夜要干什么	新婚之夜该干什么	1
臭了的肉还可以吃吗？	鲎可以吃吗？	0
这个小女孩是谁	这个小女孩叫什么？	1
苹果手机论坛哪个好	苹果手机论坛哪个好？	1
现在流行什么歌？	现在最流行谁的歌，或者什么歌	0
夕阳无限好的下一句是什么？	夕阳无限好下一句是什么?	1
可怜九月初三夜的可怜是什么意思	可怜九月初三夜，可怜是什么意思	1
不客气的，请问还有其他可以帮您的吗？	不客气的，请问还有其他可以帮您的吗？	1
依托红霉素主要用于什么的治疗	依托红霉素价钱贵吗	0
您提交后才可以帮您进行审核的哦	完成审核后，就可以的	0
蚂蚁借呗如何删除身份证照片	如何删了借呗的身份证照片	1
磁铁能吸住锌吗	镍能被磁铁吸住吗	0
怎么查别人手机短信内容?	我怎么能查别人手机短信内容	1
女人最喜欢男人做的事是什么？	男人的爱和女人的爱有区别吗？	0
什么是捡肥皂？	什么叫捡肥皂。	1
这个图片是什么牌子	看图片，这什么牌子。	1
周星驰怎么死，的	周星驰跟向太怎么了	0
求以下轻小说	求以下小说合集	0
同花顺账号登录不上去怎么办	我的平板豋录同花顺用手机账户为什么上不去	1
今天是什么日子	今天是个什么日子？	1
为什么找不到对象	女生找工作怕被骗	0
如何查询账号绑定的[机构]卡信息	多久能够查到我买基金的收益	0
乌克兰美女多吗	我可以娶乌克兰美女吗？	0
张柏芝真的要跟谢霆锋离婚吗？	张柏芝和谢霆锋真的离婚了吗	1
怎样榨果汁才好喝？	宝宝怎么喝果汁才正确?	0
有什么好玩的网游没	有什么好玩的网游。	1
红领巾是指什么	红领巾像什么	0
有什么好看的电影，悬疑之类的	有什么好看的悬疑电影	1
到健身房可以减肥吗	去健身房能减肥吗	1
热血战队怎么盲狙	热血战队怎么样	0
求一款日本游戏	找一款日本游戏，你懂的	1
今天是什么日子放鞭炮	今天什么日子这么多放鞭炮的？	1
梦见自己还有老公捡到钱	梦见别人的老公搂着还摸着自己	0
北京的明星有哪些	北京明星住的最多是哪个区	0
重庆跳蹬镇属于哪个区？	重庆属于哪个省？	0
苹果手机怎么拒绝来电啊	苹果手机怎么拒绝一切来电	1
花呗可以重新绑定支付宝账号吗	第二个注册的支付宝账号有没有花呗	0
特斯拉是什么？	什么叫特斯拉	1
好皮肤都是怎么样保养的？	皮肤要怎样保养才好	1
借呗逾期已还清 负面什么时候消除	借呗逾期之后负面记录能消吗	1
数字化城市管理系统信息采集监督员是什么编制	去香港城市大学读信息管理博士怎么样	0
最搞笑的电视剧是什么	什么电视剧搞笑	1
中国梦想秀怎么参加	怎么参加《中国梦想秀》？	1
是中华田园犬吗	这个叫中华田园狗么	1
男生红色外套怎么搭配？	红色长T恤怎么搭配衣服？裤子和外套	0
怎么样可以使头发变软？	如何使头发变软？	1
高端产品用不了怎么办	买了没法用	0
甄嬛传全集下载	是美男啊全集下载	0
养胃的食物有什么？	什么食物养胃	1
我花呗还了两次了，款都退回来，怎么回事	我的支付宝预留手机号改了，为什么还款蚂蚁花呗时还向我原来的手机号发送验证码	0
这张图片的卡通人物是什么	谁能把这张照片改动漫	0
我支付宝手机号为什么跟花呗手机号不一样	支付宝的验证手机和花呗不一样为什么	1
属鸡汽车挂件挂什么吉利	汽车挂件挂琉璃佛像好不好	0
身上酒精着火怎么办	电视着火应该怎么办	0
高粱红了象什么	一什么高粱	0
关于传奇单机架设的问题	单机传奇架设问题	1
怎么学会弹钢琴	怎样才学会弹钢琴	1
英国的钱叫什么？	英国的钱叫什么	1
三星5308手机如何截屏	三星手机长图如何截屏	0
山河对什么	恐怖分子杀人前说的什麽	0
神奇电波问题	每次都是登陆超时,什么意思	0
蚂蚁借呗额度可以降低吗	借呗额度自动降低什么情况	0
守护美丽大自然争当环保小卫士作文	争当环保小卫士	0
圣诞节送什么礼物好？	圣诞节送什么礼物好啊	1
换手机后增值服务不能使用怎么办	我换了手机号怎么办	0
二级建造师报名考试问题	关于二级建造师报名与考试的问题	1
必须这个邮箱接受邮件才可以	这个您是可以百度一下的，就是注册一个邮箱的就可以的，辛苦您了。	0
花呗的怎么一次还清	分期的花呗，如何提前还清	0
不孝有三，无后为大什么意思	不孝有三无后为大，是什么意思？	1
火车票改签可以改别人吗	本人身份证买到的火车票可以改签给别人吗	1
英皇国际娱乐会所	成都英皇娱乐会所地址	0
网上贷怎么又成蚂蚁借呗了	怎样把借呗改成网商贷	0
弹弹堂怎么样升级快？	弹弹堂怎样升级快？	1
余额宝可靠么？	余额宝可靠吗	1
怎样才会使黑色全棉的衣服裤子不褪色？	黑色的衣服掉色了，怎样让颜色恢复？	0
这两样玩具叫什么名字	玩具达人这熊叫什么名吖	0
“人”字加一笔是什么字	了字加一笔是什么字	0
梦幻西游你玩吗	想梦幻西游一样的游戏都有什么？	0
我的自传作文怎么写？	作文《我有一个梦》怎么写？	0
想回家乡的想用日语怎么念	回家日语怎么说？	0
是只有100元吗	分期最多是只能分期账单的90%的	0
一个人在家很无聊，怎么办	一个人在家很无聊怎么办呢	1
过年为什么要穿新衣服？	快过年了。衣服都穿不上了	0
凸的笔画顺序	一笔画成这个图形	0
请问什么牌子保暖内衣好	什么牌子保暖内衣好呀！	1
什么花代表友谊长存？	送女人什么花代表永远的友谊	1
耶耶耶dj那种舞蹈跳起来最好	什么舞蹈跳起来最帅？	0
在义乌哪里能吃到哈根达斯	义乌哪里有卖哈根达斯	1
巨神战击队的片尾曲是什么？	巨神战击队的片尾曲叫什么	1
谁有老男孩吉他谱？	谁有老男孩吉他谱	1
燃气热水器买什么牌子的好	什么牌子的燃气热水器好	1
如何使用短线宝软件	我前天定了短线宝,发现没有多大用处,不想要了,我要退	0
不要你做我的姐姐	我不要做你的姐姐	0
还有什么方法	有什么方法可以去痣	0
粗心大意是什么生肖	又懒又丑的生肖是什么	0
哪个牌子的电炖锅好呢	哪个牌子的电炖锅比较好用	1
现在流行什么歌啊	现在最流行什么？	1
隔夜的豆浆能喝吗？	豆浆能隔夜喝吗	1
打报告的打是什么意思	这个报告是什么意思啊	0
英国的全称是什么？	英国全称叫什么	1
这个是不能付款的	在的，只是网络有点延迟的	0
高铁票怎么订的	高铁票怎么订	1
环己烷的结构简式	二溴环己烷的结构简式	0
从武昌火车站怎么坐车去湖北生物科技职业学院	鲁巷到湖北生物科技职业学院怎么走？	0
这是什么灌木？	这是什么灌木呢	1
腋下疤痕求大师解答解答	修复疤痕求大师解答解答	0
梦幻西游魔王起什么名字	梦幻西游好听的名字有哪些？	0
一部老的武侠电视剧	跪求一部老的电视剧	0
我把之前的账号花呗关了，现在的账号还是开不了	我开通的花呗	0
中国男篮今天的比赛几点开始？哪个台直播？	中国好声音第二季第一期今晚会播出吗？	0
兰岛物语少女的约定下载	兰岛物语(少女的约定)下载	1
逆战挂机脚本	逆战挂机脚本！	1
怎么刷手机流量	我手机怎么加流量？	1
借呗还有欠款，本月还过之后为什么显示没有额度	借呗，***??***号的，已经还清，为什么，还显示得有还款金额	0
电磁波和红外线烤灯哪个好	电磁波烤灯和红外线哪个好	1
有什么好看的动漫介绍吗	有什么好看的动漫没介绍	1
微商怎么加入	怎么加入微商	1
什么方法减肚子最有效呢？	减肚子最快最有效的方法是什么	1
具体看不到呢	您好，您可以调整时间范围查询一下	0
能否重新起用花呗	花呗封了多久能重新开通	1
谁喜欢王源？	谁喜欢王俊凯？	0
自己家的宽带怎么开钻？	用别人的宽带账号可以给自己开钻吗	0
同花顺账号登录不上去怎么办	我刚开的户怎么登录不上	0
今天上班吗？	快递现在有上班吗？表骗我}	0
花呗逾期还款最多逾期几天	花呗还款当天时间	0
亲，可以注册的	注册满30天才可以注销的	0
为什么新股申购数量为零	怎么总是看不了论股	0
网上有哪些赚钱门路？	行之有效的赚钱门路有哪些	0
怎样唱歌好听	怎样唱歌才好听	1
亲，这边核实是没有到账的呢	但是这边是没有核实到您是有操作转入３００的。	0
妞，给爷笑一个！不行大爷给你笑一个！	帮忙想一个舞团简介~团名:爷、给妞笑①个	0
到新西兰买什么	去新西兰买什么	1
手机小说下载网站	什么软件可以让电子书自己阅读	0
怎么系鞋带？好看？	怎么系鞋带好看？	1
虹猫蓝兔的插曲	人在囧途的插曲	0
真的近义词是什么	率真的近义词是什么	0
怎样买新浪微博粉丝	新浪微博怎么买粉丝	1
我时空猎人号被盗怎样找回	时空猎人号被盗了，怎样找回	1
寄生兽什么时候更新？	寄生兽什么时候更新	1
手机怎样下载漫画	我的手机怎么下载漫画看	1
就是对方转账的那个2015开头的交易号哦。	看到是交易成功的。支付宝--交易记录--详情联系下卖家是否可以联系	0
感叹号什么意思	这个感叹号是什么意思	1
怎样在网上订烟	在网上怎么找这个图片	0
手机level2如何升级为云端版level2	你们level_2到底多少钱	0
小黄人可爱吗？	小黄人可爱吗	1
安然是什么意思？	安然对待是什么意思?	0
信用卡淘宝支付限额么	怎么改淘宝的账户名？	0
全职妈妈适合做什么工作	什么生意比较适合在家带宝宝的全职妈妈	1
嫂子过生日送什么好呢	小姑子过生日嫂子送什么礼物好	0
大连交通大学在哪个区	大连交通大学多么破	0
可以提升借呗额度麽	借呗还会提升吗	0
死痛苦吗，怎么样死不疼，	怎么死最痛苦	0
李小龙是怎么死	李小龙怎么死的	1
帮我把图片上的字去掉	帮我去掉图片的字	1
这个帅哥叫什么？	这个帅哥是谁啊	1
张信哲的老婆是谁啊	张信哲老婆是谁	1
什么是钻石绒	这个钻石烟叫什么？	0
你哪里黑鬼香烟怎么卖呢	你这里还卖黑鬼香烟不？	0
新成立的基金什么时候可以赎回	新设立的基金什么时候可以卖	1
梅江区城管投诉电话是多少？	花地城管投诉电话是多少？	0
有哪些中文版单机游戏？	最好玩的中文单机游戏是哪些	1
明天会更好。	过年后的天气会是怎样？	0
手机已经注册过了怎么重新注册	我这个那这个手机已经注册过同花顺,还能再注册一次吗	1
形容时间很短的成语	形容时间短的成语有哪些	1
微创手术痔疮	痔疮微创手术	1
形容品德高尚的成语	形容品德高尚成语	1
情人节送女朋友什么好？	情人节送女朋友什么好	1
有什么好的打字软件？	有什么好的打字测速软件	0
赛尔号怎么吸经验	赛尔号怎么加经验	1
求好看的都市异能小说	求好看的都市异能类小说	1
别人骂我是倒王八什么意思	王八是什么意思？	0
肾衰宁胶囊是中药吗	肾衰宁胶囊具有中药成分吗	1
孕妇能吃蘑菇吗？、	孕妇蘑菇能吃吗	1
千金归来哪一集有吻戏	情深深雨蒙蒙吻戏在哪拍的	0
《天天向上》好看吗？	天天向上好看吗	1
换号码对支付宝借呗额度有影响吗	会不会?影响?借呗?额度	0
重庆话哈搓搓是什么意思	重庆话绝是什么意思	0
我的借呗删除了之后，为什么现在加不了了	为什么我蚂蚁借呗开通有额度，现在没有了进不去	0
为什么人都喜欢欺负人？	为什么那些欺负人的同学那么喜欢欺负人。	0
用花呗分期买的，退货后怎么还在让我分期还、款	我就是想问问 淘宝花呗分期付款买东西 如果付了一期后 到货了 不喜欢想退货 后面俩期要不要取消分期的	0
忘记股票账号和密码怎么办	手机上看不到资金帐号,怎么办	1
感冒可以喝可乐吗	感冒能喝可乐吗	1
花呗还了最低还款 还算逾期吗	花呗还最低的还款额，剩下的有没有算	0
这样的指甲怎样修好看？	怎样让指甲变好看？	0
郭德纲的经典相声有哪些	郭德纲十大经典相声有哪些	1
武媚娘与李世民共浴在第几集	武媚娘和李世民共浴是第几集	1
如何打开对方的摄像头？	如何打开别人的摄像头	1
如何查看自己购买的基金	我的基金持仓没增加,现实受理失败,钱都扣了,怎么回事啊	0
付款的时候选择余额宝付款即可	就是您付款的时候选择余额宝付款	1
最近热播的电视剧都有什么	最近有什么热播电视剧	1
今年冬天流行什么衣服呢？	今年冬天流行什么衣服呢	1
怎样和人搭讪，	怎么跟女的搭讪	1
怎么切油条啊	怎么做油条？	0
客厅适合挂什么字	客厅里适合放什么花	0
九阴真经好玩吗	九阴真经好玩嘛？	1
微店怎么操作	微店怎样操作？	1
崔璀结婚了吗？	晟敏结婚了吗？	0
按键精灵代码改成后台	按键精灵代码错误	0
哪可以看一个人的武林	一个人的武林，在那能看	1
